{
 "schema": "https://w3id.org/parliamentrag/verify/v1",
 "system": {
  "name": "Fascicoli",
  "url": "https://www.fascicoli.it"
 },
 "question": "Cosa hanno detto i gruppi sulle risorse della legge di bilancio?",
 "generated_at": "2026-10-07T14:24:02.870980+02:00",
 "period": {
  "from": "2022-11-10",
  "to": "2026-05-11"
 },
 "chambers": [
  "camera"
 ],
 "data_version": "2026-10-07",
 "claims": [
  {
   "id": "1",
   "speaker": "gov_giorgetti_giancarlo",
   "government": true,
   "speech": "leg19_sed552_tit00130.sub00080.int00060",
   "quote": "vengono ora previste articolate misure che consentono di reperire risorse per continuare il processo di risanamento dei conti pubblici, assicurando, al contempo, sostanziali interventi a favore della sanità, della famiglia e dei meno abbienti",
   "link": "https://www.camera.it/leg19/410?idSeduta=0552&tipo=stenografico#sed0552.stenografico.tit00130.sub00080.int00060"
  },
  {
   "id": "2",
   "speaker": "http://dati.camera.it/ocd/persona.rdf/p307496",
   "group": "http://dati.camera.it/ocd/gruppoParlamentare.rdf/gr4134",
   "speech": "leg19_sed219_tit00050.sub00010.int00080",
   "quote": "c'è sempre, come ho detto prima, la possibilità di fare di più, ma oggi con le risorse a disposizione, con gli attuali limiti di utilizzo dell'indebitamento e, soprattutto, con la necessità di tenere in continuo ordine, visto che dobbiamo affrontare anche quelle sfide europee importanti, abbiamo predisposto misure importanti per il nostro Paese",
   "link": "https://www.camera.it/leg19/410?idSeduta=0219&tipo=stenografico#sed0219.stenografico.tit00050.sub00010.int00080"
  },
  {
   "id": "3",
   "speaker": "http://dati.camera.it/ocd/persona.rdf/p307457",
   "group": "http://dati.camera.it/ocd/gruppoParlamentare.rdf/gr4133",
   "speech": "leg19_sed26_tit00060.sub00010.int00060",
   "quote": "l'altro aspetto da considerare - che poi è un po' una novità – è che non si tratta di una manovra finanziaria da ragionieri ma contiene finalmente una visione politica. Riguardo ai 35 miliardi che vengono impiegati si evidenziano sostanzialmente due priorità: quella della crescita, finalmente, e quella della giustizia sociale",
   "link": "https://www.camera.it/leg19/410?idSeduta=0026&tipo=stenografico#sed0026.stenografico.tit00060.sub00010.int00060"
  },
  {
   "id": "4",
   "speaker": "http://dati.camera.it/ocd/persona.rdf/p307630",
   "group": "http://dati.camera.it/ocd/gruppoParlamentare.rdf/gr4132",
   "speech": "leg19_sed176_tit00030.sub00010.int00020",
   "quote": "le risorse saranno, altresì, finalizzate a potenziare gli investimenti pubblici, con priorità per quelli previsti nell'ambito del Piano nazionale di ripresa e resilienza e a finanziare le politiche invariate",
   "link": "https://www.camera.it/leg19/410?idSeduta=0176&tipo=stenografico#sed0176.stenografico.tit00030.sub00010.int00020"
  },
  {
   "id": "5",
   "speaker": "http://dati.camera.it/ocd/persona.rdf/p307603",
   "group": "http://dati.camera.it/ocd/gruppoParlamentare.rdf/gr4152",
   "speech": "leg19_sed362_tit00090.sub00010.int00120",
   "quote": "l'ultimo aspetto che Noi Moderati sta seguendo non solo in questo disegno di legge, ma anche per quanto riguarda la prossima legge di bilancio, è la conciliazione fra lavoro e famiglia",
   "link": "https://www.camera.it/leg19/410?idSeduta=0362&tipo=stenografico#sed0362.stenografico.tit00090.sub00010.int00120"
  },
  {
   "id": "6",
   "speaker": "http://dati.camera.it/ocd/persona.rdf/p308810",
   "group": "http://dati.camera.it/ocd/gruppoParlamentare.rdf/gr4154",
   "speech": "leg19_sed588_tit00040.sub00010.int00330",
   "quote": "avete persino immaginato di utilizzare la manovra per approvare, senza discussione, una nuova versione dell'autonomia differenziata. Che altro sono, se non questo, i livelli essenziali delle prestazioni infilati nella legge di bilancio, ma senza risorse",
   "link": "https://www.camera.it/leg19/410?idSeduta=0588&tipo=stenografico#sed0588.stenografico.tit00040.sub00010.int00330"
  },
  {
   "id": "7",
   "speaker": "http://dati.camera.it/ocd/persona.rdf/p308244",
   "group": "http://dati.camera.it/ocd/gruppoParlamentare.rdf/gr4135",
   "speech": "leg19_sed401_tit00050.sub00010.int00100",
   "quote": "non si può non rilevare, effettivamente, che questa manovra è coerente con quel Piano strutturale di bilancio che ha come elemento definitivo - lo diranno sicuramente i colleghi della maggioranza in discussione generale - l'obiettivo della tenuta dei conti pubblici e questo va ricordato essere sicuramente un dato positivo",
   "link": "https://www.camera.it/leg19/410?idSeduta=0401&tipo=stenografico#sed0401.stenografico.tit00050.sub00010.int00100"
  },
  {
   "id": "8",
   "speaker": "http://dati.camera.it/ocd/persona.rdf/p306382",
   "group": "http://dati.camera.it/ocd/gruppoParlamentare.rdf/gr4211",
   "speech": "leg19_sed402_tit00140.sub00020.int00060",
   "quote": "è una manovra che non aiuta la crescita, che ancora si regge sul PNRR, peraltro in pesante ritardo. È buona per il rispetto del Piano strutturale di bilancio, anche se, Ministro, le suono il primo campanello d'allarme dall'Ufficio parlamentare di bilancio: mancano informazioni sulla crescita della spesa netta",
   "link": "https://www.camera.it/leg19/410?idSeduta=0402&tipo=stenografico#sed0402.stenografico.tit00140.sub00020.int00060"
  },
  {
   "id": "9",
   "speaker": "http://dati.camera.it/ocd/persona.rdf/p308841",
   "group": "http://dati.camera.it/ocd/gruppoParlamentare.rdf/gr4131",
   "speech": "leg19_sed196_tit00090.sub00010.int00660",
   "quote": "pertanto, bisogna urgentemente modificare questa maldestra manovra di bilancio, insufficiente e truffaldina, stanziando le necessarie risorse per la sanità e per il contrasto alla povertà",
   "link": "https://www.camera.it/leg19/410?idSeduta=0196&tipo=stenografico#sed0196.stenografico.tit00090.sub00010.int00660"
  },
  {
   "id": "10",
   "speaker": "http://dati.camera.it/ocd/persona.rdf/p306412",
   "group": "http://dati.camera.it/ocd/gruppoParlamentare.rdf/gr4136",
   "speech": "leg19_sed401_tit00050.sub00010.int00060",
   "quote": "nonostante sia stata ampiamente riscritta, questa legge appare priva di elementi cruciali",
   "link": "https://www.camera.it/leg19/410?idSeduta=0401&tipo=stenografico#sed0401.stenografico.tit00050.sub00010.int00060"
  },
  {
   "id": "11",
   "speaker": "http://dati.camera.it/ocd/persona.rdf/p307902",
   "group": "http://dati.camera.it/ocd/componenteGruppoMisto.rdf/cgm4137",
   "speech": "leg19_sed220_tit00110.sub00010.int00040",
   "quote": "nel merito della legge di bilancio, una considerazione è d'obbligo. In relazione alle risorse disponibili con una manovra di bilancio che opera inevitabilmente, per la maggior parte delle misure, in deficit, le priorità indicate dal Governo sono condivisibili",
   "link": "https://www.camera.it/leg19/410?idSeduta=0220&tipo=stenografico#sed0220.stenografico.tit00110.sub00010.int00040"
  }
 ]
}
