{
 "schema": "https://w3id.org/parliamentrag/verify/v1",
 "system": {
  "name": "Fascicoli",
  "url": "https://www.fascicoli.it"
 },
 "question": "Cosa hanno detto i gruppi sulla riforma delle pensioni?",
 "generated_at": "2026-10-07T14:46:08.546794+02:00",
 "period": {
  "from": "2022-12-22",
  "to": "2026-06-17"
 },
 "chambers": [
  "camera"
 ],
 "data_version": "2026-10-07",
 "claims": [
  {
   "id": "1",
   "speaker": "gov_bellucci_maria_teresa",
   "government": true,
   "speech": "leg19_sed128_tit00090.sub00020.int00060",
   "quote": "sull'ordine del giorno n. 9/1238/71 Morfino il parere è favorevole con riformulazione dell'impegno: “a valutare l'opportunità di rivedere, compatibilmente con i vincoli di finanza pubblica, la disciplina dell'uscita pensionistica della cosiddetta opzione donna",
   "link": "https://www.camera.it/leg19/410?idSeduta=0128&tipo=stenografico#sed0128.stenografico.tit00090.sub00020.int00060"
  },
  {
   "id": "2",
   "speaker": "http://dati.camera.it/ocd/persona.rdf/p307456",
   "group": "http://dati.camera.it/ocd/gruppoParlamentare.rdf/gr4134",
   "speech": "leg19_sed604_tit00060.sub00020.int00160",
   "quote": "la Costituzione lega il diritto alla previdenza alla dignità della persona e alla funzione sociale del lavoro. È per questo che, ogni volta che questo Parlamento discute di pensioni, non sta discutendo soltanto di requisiti o di finestre di uscita, ma della serietà dello Stato e della sua capacità di essere giusto oggi senza essere ingiusto domani",
   "link": "https://www.camera.it/leg19/410?idSeduta=0604&tipo=stenografico#sed0604.stenografico.tit00060.sub00020.int00160"
  },
  {
   "id": "3",
   "speaker": "http://dati.camera.it/ocd/persona.rdf/p308796",
   "group": "http://dati.camera.it/ocd/gruppoParlamentare.rdf/gr4133",
   "speech": "leg19_sed100_tit00050.sub00020.int00240",
   "quote": "nel prosieguo dell'azione di Governo, fermo restando il reperimento delle risorse economiche e nel rispetto dei vincoli di finanza pubblica, chiediamo un impegno anche per individuare necessarie forme di flessibilità di accesso per le donne al trattamento pensionistico e/o di anticipo pensionistico",
   "link": "https://www.camera.it/leg19/410?idSeduta=0100&tipo=stenografico#sed0100.stenografico.tit00050.sub00020.int00240"
  },
  {
   "id": "4",
   "speaker": "http://dati.camera.it/ocd/persona.rdf/p307508",
   "group": "http://dati.camera.it/ocd/gruppoParlamentare.rdf/gr4132",
   "speech": "leg19_sed100_tit00050.sub00020.int00140",
   "quote": "noi abbiamo anche provato a modificarla, e auspico che una riforma organica del sistema previdenziale vada fatta, perché questo è un Governo finalmente politico e ha l'ambizione di rimanere in carica 5 anni , che ci porteranno anche al superamento delle storture della legge Fornero",
   "link": "https://www.camera.it/leg19/410?idSeduta=0100&tipo=stenografico#sed0100.stenografico.tit00050.sub00020.int00140"
  },
  {
   "id": "5",
   "speaker": "http://dati.camera.it/ocd/persona.rdf/p307603",
   "group": "http://dati.camera.it/ocd/gruppoParlamentare.rdf/gr4152",
   "speech": "leg19_sed604_tit00060.sub00020.int00080",
   "quote": "garantire pensioni adeguate significa anche garantire la sostenibilità economica del sistema, perché solo un sistema sostenibile può assicurare equità nel tempo",
   "link": "https://www.camera.it/leg19/410?idSeduta=0604&tipo=stenografico#sed0604.stenografico.tit00060.sub00020.int00080"
  },
  {
   "id": "6",
   "speaker": "http://dati.camera.it/ocd/persona.rdf/p308869",
   "group": "http://dati.camera.it/ocd/gruppoParlamentare.rdf/gr4154",
   "speech": "leg19_sed133_tit00150.sub00010.int00040",
   "quote": "un salario minimo e pensioni minime che diano una vita dignitosa a queste famiglie è il minimo da fare per questo Governo e per questo Parlamento",
   "link": "https://www.camera.it/leg19/410?idSeduta=0133&tipo=stenografico#sed0133.stenografico.tit00150.sub00010.int00040"
  },
  {
   "id": "7",
   "speaker": "http://dati.camera.it/ocd/persona.rdf/p308244",
   "group": "http://dati.camera.it/ocd/gruppoParlamentare.rdf/gr4135",
   "speech": "leg19_sed337_tit00080.sub00070.int00130",
   "quote": "sempre INPS e Istat denunciano che, se, come è vero, nel 2050 ci aspettiamo una popolazione il cui 35 per cento sia superiore ai 65 anni di età, noi dobbiamo rivedere totalmente l'approccio del welfare del nostro Paese. A questo affianchiamo il fatto che INPS dice che, entro 10 anni, ha già una previsione di un buco finanziario di 20 miliardi",
   "link": "https://www.camera.it/leg19/410?idSeduta=0337&tipo=stenografico#sed0337.stenografico.tit00080.sub00070.int00130"
  },
  {
   "id": "8",
   "speaker": "http://dati.camera.it/ocd/persona.rdf/p306382",
   "group": "http://dati.camera.it/ocd/gruppoParlamentare.rdf/gr4211",
   "speech": "leg19_sed604_tit00060.sub00020.int00060",
   "quote": "signori del Governo, onorevoli colleghi, le pensioni sono un tema serio, sono uno di quei temi fondamentali che misurano il patto sociale Stato-cittadino. È talmente serio che deve richiedere nel nostro dibattito due piani: il piano dei principi e il piano dei conti",
   "link": "https://www.camera.it/leg19/410?idSeduta=0604&tipo=stenografico#sed0604.stenografico.tit00060.sub00020.int00060"
  },
  {
   "id": "9",
   "speaker": "http://dati.camera.it/ocd/persona.rdf/p308844",
   "group": "http://dati.camera.it/ocd/gruppoParlamentare.rdf/gr4131",
   "speech": "leg19_sed604_tit00060.sub00020.int00140",
   "quote": "chiediamo di rendere strutturali strumenti come APE sociale e di ripristinare una vera Opzione donna che, prima, avete ristretto e, poi, smontato del tutto",
   "link": "https://www.camera.it/leg19/410?idSeduta=0604&tipo=stenografico#sed0604.stenografico.tit00060.sub00020.int00140"
  },
  {
   "id": "10",
   "speaker": "http://dati.camera.it/ocd/persona.rdf/p302069",
   "group": "http://dati.camera.it/ocd/gruppoParlamentare.rdf/gr4136",
   "speech": "leg19_sed119_tit00030.sub00010.int00040",
   "quote": "di fronte a questo tema, le proposte avanzate all'interno della mozione di maggioranza, che ho letto e che ovviamente rispetto, mi sembrano molto, molto deboli. Capisco che non ci si possa muovere in maniera troppo disallineata rispetto all'attuale Governo ma si fa fatica a immaginare un innalzamento a 600 euro solo per gli ultra settantacinquenni",
   "link": "https://www.camera.it/leg19/410?idSeduta=0119&tipo=stenografico#sed0119.stenografico.tit00030.sub00010.int00040"
  },
  {
   "id": "11",
   "speaker": "http://dati.camera.it/ocd/persona.rdf/p301577",
   "group": "http://dati.camera.it/ocd/componenteGruppoMisto.rdf/cgm4139",
   "speech": "leg19_sed604_tit00060.sub00020.int00020",
   "quote": "l'Italia è il Paese che spende di più per pensioni nell'OCSE, a parte la Grecia, ed è il Paese con la demografia peggiore dal punto di vista dell'evoluzione della spesa previdenziale. Sempre secondo dati dell'OCSE del 2024, siamo il Paese con più popolazione sopra i 65 anni e con i tassi della dinamica demografica peggiori",
   "link": "https://www.camera.it/leg19/410?idSeduta=0604&tipo=stenografico#sed0604.stenografico.tit00060.sub00020.int00020"
  }
 ]
}
